{
  "$schema": "../schema/poem.config.schema.json",
  "title": "ألفية ابن مالك",
  "author": "ابن مالك الطائي الجَيّاني",
  "lang": "ar",
  "dir": "rtl",
  "layout": "paged",
  "domain": "alfiya.benjelloun.dev",
  "siteName": "shatr",
  "description": "ألفية ابن مالك في النحو والصرف — أرجوزةٌ تعليميةٌ نظمها جمالُ الدين محمد بن مالك (ت 672هـ). هذا الموقع قيد الإنشاء؛ يُضاف المتنُ كاملاً من نسخةٍ محقَّقة.",
  "keywords": ["ألفية ابن مالك", "ابن مالك", "النحو", "الصرف", "الخلاصة في النحو", "رجز", "متن"],
  "about": "منظومةٌ في قواعد النحو والصرف العربي في نحو ألف بيتٍ من الرجز.",
  "dates": { "signatureLine": "نظم جمال الدين ابن مالك الطائي الجَيّاني (ت 672هـ)" },
  "theme": { "themeColor": "#f5f5f4", "splashColor": "#1c1a17" },
  "resources": { "whatsapp": true },
  "footer": { "credit": "أُعِدَّ بإطار", "name": "شطر", "dateLine": "قيد الإنشاء — يُضاف المتن كاملاً من نسخةٍ محقَّقة" }
}
